"DESCRIPTION","DURATION IN MS","NAME","PARENT SUITE","START TIME","STATUS","STOP TIME","SUB SUITE","SUITE","TEST CLASS","TEST METHOD"
"","1743","The member logining","","Wed May 14 15:10:32 UTC 2025","passed","Wed May 14 15:10:33 UTC 2025","","","",""
"Ce test est spécialement pour ajouter tous les employés via un fichier excel déjà rempli .","20621","Login and add all employees from file Excel","Automation Project","Wed May 14 15:10:23 UTC 2025","passed","Wed May 14 15:10:43 UTC 2025","Add Employees With excelFiles","OrangeHrm","",""
"","593","get started link","","Wed May 14 15:10:19 UTC 2025","passed","Wed May 14 15:10:20 UTC 2025","","","",""
"","8714","Login and add employees from Excel","","Wed May 14 15:10:10 UTC 2025","passed","Wed May 14 15:10:18 UTC 2025","","","",""
"Ce test vérifie la connexion avec des identifiants valides.","7199","Connexion utilisateur valide","Automation Project","Wed May 14 15:10:24 UTC 2025","passed","Wed May 14 15:10:32 UTC 2025","Authentification","OrangeHrm","",""
"Ce test est le premier aprés avoir initier le projet .","357","has title","Automation Project","Wed May 14 15:10:19 UTC 2025","passed","Wed May 14 15:10:19 UTC 2025","First test","playwright","",""
"Ce test a pour but d'ouvrire une nouvelle fenêtre et maîtriser les checkBox / buton radio .","14959","Test automatisé Playwright","Automation Project","Wed May 14 15:11:07 UTC 2025","failed","Wed May 14 15:11:22 UTC 2025","New window","OrangeHrm","",""
"Ce test est Pour Gérer un nouvel onglet et revenir à la page principale .","4630","Gérer un nouvel onglet et revenir à la page principale","Automation Project","Wed May 14 15:10:20 UTC 2025","passed","Wed May 14 15:10:24 UTC 2025","Add Employees With excelFiles","OrangeHrm","",""
"Ce test est spécialement pour ajouter tous les employés via un fichier excel déjà rempli .","2982","Accéder sur le site et s'authentifier","Automation Project","Wed May 14 15:10:44 UTC 2025","passed","Wed May 14 15:10:47 UTC 2025","authentification & saisir les données dans la page pim","OrangeHrm","",""
